{"submission_id":"rclog_rub_it_0002_excellent_01","profile_generated_at":"2026-01-13T05:30:00Z","scores":{"critical_thinking_score":0.75,"problem_solving_score":0.8,"engagement_score":0.85},"ai_use_pattern":"mixed","process_notes":"Mock profiling analysis for rclog_rub_it_0002_excellent_01. Student shows balanced AI usage with both content generation and revision patterns.","indicator_metrics":{"critical_thinking":{"explanation_prompts":1,"verification_prompts":0,"comparison_prompts":0,"evidence_prompts":0},"problem_solving":{"decomposition_prompts":0,"iterative_revision_count":4,"self_proposed_content_turns":0,"feedback_uptake_events":0},"engagement":{"student_token_ratio":0.6,"student_turn_count":5,"distinct_episode_types":2,"session_time_minutes":15.0},"prompt_type_distribution":{"understand_prompt":0,"plan_structure":0,"generate_content":1,"revise_content":1,"polish_language":0,"check_quality":0}},"explainability_evidence":{"critical_thinking":{"confidence":0.7,"evidence":["Student asked for help with essay structure"]},"problem_solving":{"confidence":0.8,"evidence":["Student made multiple revisions to improve content"]},"engagement":{"confidence":0.85,"evidence":["Student maintained consistent interaction throughout"]},"ai_use_pattern":{"confidence":0.75,"evidence":["Mixed pattern of generation and revision detected"]}}}