{
  "submission_id": "rclog_zero_trust_example",
  "profile_generated_at": "2026-01-11T08:15:30.989653+00:00",
  "scores": {
    "critical_thinking_score": 0.0825,
    "problem_solving_score": 0.0,
    "engagement_score": 0.31499999999999995
  },
  "ai_use_pattern": "mixed",
  "process_notes": "The student demonstrated a balanced mix of behaviours without a dominant pattern.",
  "indicator_metrics": {
    "critical_thinking": {
      "explanation_prompts": 1,
      "verification_prompts": 0,
      "comparison_prompts": 0,
      "evidence_prompts": 0
    },
    "problem_solving": {
      "decomposition_prompts": 0,
      "iterative_revision_count": 0,
      "self_proposed_content_turns": 0,
      "feedback_uptake_events": 0
    },
    "engagement": {
      "student_token_ratio": 0.03506650544135429,
      "student_turn_count": 4,
      "prompt_type_diversity": 3,
      "distinct_episode_types": 3,
      "session_time_minutes": 8.0,
      "session_duration_is_proxy": true,
      "session_minutes": 8.0
    },
    "prompt_type_distribution": {
      "understand_prompt": 0,
      "plan_structure": 2,
      "generate_content": 1,
      "revise_content": 1,
      "polish_language": 0,
      "check_quality": 0,
      "unknown_prompt_type": 0
    }
  },
  "explainability_evidence": {
    "critical_thinking": {
      "confidence": 0.0825,
      "evidence": [
        "I need to write a 1500-word academic essay on zero-trust architecture in enterprise security. Can you briefly explain the core principles of zero-trust and give me a high-level outline for the essay?"
      ]
    },
    "problem_solving": {
      "confidence": 0.0,
      "evidence": []
    },
    "engagement": {
      "confidence": 0.31499999999999995,
      "evidence": [
        "Refine this outline into more detailed section headings with bullet points for what I should cover in each section, making sure I address benefits, challenges, and at least one concrete breach example.",
        "I need to write a 1500-word academic essay on zero-trust architecture in enterprise security. Can you briefly explain the core principles of zero-trust and give me a high-level outline for the essay?"
      ]
    },
    "ai_use_pattern": {
      "confidence": 0.5,
      "evidence": [
        "I need to write a 1500-word academic essay on zero-trust architecture in enterprise security. Can you briefly explain the core principles of zero-trust and give me a high-level outline for the essay?",
        "Refine this outline into more detailed section headings with bullet points for what I should cover in each section, making sure I address benefits, challenges, and at least one concrete breach example."
      ]
    }
  }
}