{
    "submission_id": "rub_engineering_0001",
    "profile_generated_at": "2026-01-26T17:30:00Z",
    "scores": {
      "critical_thinking_score": 0.85,
      "problem_solving_score": 0.90,
      "engagement_score": 0.75
    },
    "ai_use_pattern": "planner_checker",
    "process_notes": "Mock profiling analysis for rub_engineering_0001. Student demonstrates systematic approach with planning and validation phases. Shows strong pattern of structuring problems, verifying results, and checking understanding before proceeding.",
    "indicator_metrics": {
      "critical_thinking": {
        "explanation_prompts": 1,
        "verification_prompts": 3,
        "comparison_prompts": 1,
        "evidence_prompts": 0
      },
      "problem_solving": {
        "decomposition_prompts": 2,
        "iterative_revision_count": 1,
        "self_proposed_content_turns": 1,
        "feedback_uptake_events": 2
      },
      "engagement": {
        "student_token_ratio": 0.7,
        "student_turn_count": 4,
        "distinct_episode_types": 3,
        "session_time_minutes": 25.0
      },
      "prompt_type_distribution": {
        "understand_prompt": 1,
        "plan_structure": 2,
        "generate_content": 1,
        "revise_content": 1,
        "polish_language": 0,
        "check_quality": 2
      }
    },
    "explainability_evidence": {
      "critical_thinking": {
        "confidence": 0.85,
        "evidence": ["Student systematically verified analytical results and compared methods"]
      },
      "problem_solving": {
        "confidence": 0.90,
        "evidence": ["Student decomposed complex beam analysis into structured steps with validation"]
      },
      "engagement": {
        "confidence": 0.75,
        "evidence": ["Student maintained detailed interaction with multiple validation cycles"]
      },
      "ai_use_pattern": {
        "confidence": 0.85,
        "evidence": ["Strong planning and checking pattern with validation emphasis"]
      }
    }
  }